{
  "kind": "integration-test",
  "identity": "louke.contract.v0.14-002.integration-test",
  "revision": "prism-round-3-remediation-candidate",
  "schema_ref": {"identity": "louke.machine-contract.integration-test", "version": "1.0.0", "digest": "sha256:db63276e04f52b8f6c22ea10133663a36227c4901050356e1479570b1ef91e98"},
  "manifest_ref": {"identity": "louke.design-artifacts.v0.14-002.prism-r3-remediation", "revision": "prism-round-3-remediation-candidate"},
  "scope": {"workspace_id": "github.com/zillionare/louke", "spec_id": "v0.14-002-workflow-reflow-design", "base_commit": "2734177ef5398e4c10a1f68039ec469ccc21f2b8", "project_facts_digest": "sha256:4b1a523c1cf946b480162e5321d3c92aeebdea75f57d5768948aee6f76672130", "project_facts_artifact": {"kind": "host-project-facts-snapshot", "path": "design-artifacts/inputs/host-project-facts.snapshot.json", "identity": "louke.host-project-facts.github.com-zillionare-louke", "revision": "base-2734177-workspace-2026-07-20-r2"}, "release_identity": "0.14.0"},
  "generated_by": {"owner": "Runtime/program", "role": "Archer", "task_manifest_digest": "sha256:0a9d58474340e9520af49d2bea462c41533c1fabc81afbcf4f5f292caecefbfc", "task_manifest_artifact": {"kind": "archer-author-task-manifest", "path": "design-artifacts/inputs/archer-author-task-manifest.candidate.json", "identity": "runtime.v0.14-002.m-design.archer.prism-r3-remediation", "revision": "prism-round-3-remediation-candidate"}},
  "compatible_runtime": ">=0.14.0,<0.15.0",
  "artifact_refs": [
    {"path": ".louke/project/specs/v0.14-002-workflow-reflow-design/test-plan.md", "digest": "sha256:02a928e09f4abc80ae6ec0c60ec39ba33a131cfd5acc47dc3daeeab97cb4d53e", "ac_ids": ["AC-FR0100-01","AC-FR0200-01","AC-FR0300-01","AC-FR0400-01","AC-FR0500-01","AC-FR0600-01","AC-FR0700-01","AC-FR0800-01","AC-FR0900-01","AC-FR1000-01","AC-FR1100-01","AC-FR1200-01","AC-FR1300-01","AC-FR1400-01","AC-FR1500-01","AC-FR1600-01","AC-FR1700-01","AC-FR1800-01","AC-FR1900-01","AC-FR2000-01","AC-FR2050-01","AC-FR2100-01","AC-FR2200-01","AC-FR2300-01","AC-FR2400-01","AC-FR2500-01","AC-FR2600-01","AC-FR2700-01","AC-NFR0100-01","AC-NFR0200-01","AC-NFR0300-01","AC-NFR0400-01","AC-NFR0500-01","AC-NFR0600-01"], "interface_ids": ["IF-DES-01","IF-DES-02","IF-CON-01","IF-REG-01","IF-TST-01","IF-PC-01","IF-CI-01","IF-REL-01","IF-BLD-01","IF-PUB-01","IF-PRM-01","IF-REV-01","IF-WEB-01","IF-FCT-01","IF-AUD-01"], "architecture_anchors": ["ARC-WEB","ARC-DESIGN","ARC-FACTS","ARC-REGISTRY","ARC-CONTRACTS","ARC-VALIDATE","ARC-PROMPTS","ARC-CI","ARC-PRECOMMIT","ARC-VERSION","ARC-BUILD","ARC-PUBLISH","ARC-REVIEW","ARC-STORE","ARC-MIGRATION","ARC-SECURITY"], "contract_kind": "integration-test"},
    {"path": ".louke/project/specs/v0.14-002-workflow-reflow-design/interfaces.md", "digest": "sha256:ce4e83ae0d0f614a43a1912e317859105f84f08ba53fc3e8b1cc150dd108e37f", "ac_ids": ["AC-FR0400-01","AC-FR0700-01","AC-FR0800-01","AC-NFR0500-01"], "interface_ids": ["IF-CON-01","IF-REG-01","IF-TST-01"], "architecture_anchors": ["ARC-CONTRACTS","ARC-REGISTRY","ARC-VALIDATE","ARC-CI","ARC-SECURITY"], "contract_kind": "integration-test"},
    {"path": ".louke/project/specs/v0.14-002-workflow-reflow-design/architecture.md", "digest": "sha256:32c88eb2062eb0173738086202eddf87122204ee99d32133c1ea30a6c39335cc", "ac_ids": ["AC-FR0500-01","AC-FR0800-01"], "interface_ids": ["IF-TST-01"], "architecture_anchors": ["ARC-CONTRACTS","ARC-CI","ARC-SECURITY"], "contract_kind": "integration-test"}
  ],
  "payload": {
    "commands": [{"id": "integration-public", "cwd": ".", "command": "tests/e2e/run-project-venv integration", "implementation_state": "candidate-change-required", "success": "Historical and tests/integration/v014_design_contracts required nodes/AC-layers all collected exactly once and passed; evidence and teardown valid", "failure": "Missing path, zero collection,漏跑,skip,not-run,unknown,nonzero,timeout,cancel,evidence mismatch or teardown failure returns nonzero"}],
    "paths": ["tests/integration/install_experience", "tests/integration/v014_design_contracts", "tests/fixtures/v014_design_contracts", "tests/ground_truth/v014_design_contracts"],
    "discovery": {"framework": "pytest", "expected_manifest": "design-artifact-manifest.candidate.json AC/layer closure", "preserve_historical": true, "zero_collection": "nonzero"}, "runner": "tests/e2e/run-project-venv", "setup": ["use repository .venv Python only", "install locked test dependencies", "create isolated temp Git workspace/HOME/XDG"], "run": "tests/e2e/run-project-venv integration", "services": [], "fixtures": ["approved_design_inputs","host_matrix","schema_registry_matrix","design_closure_matrix","prompt_matrix","ci_hook_matrix","release_artifact_matrix","publish_matrix","review_restart_matrix","legacy_matrix","secret_canaries"], "environment": {"production_secrets": false, "network_publish": false, "external_services": "protocol-faithful stand-ins", "core_modules_mocked": false}, "timeout_seconds": 1800,
    "suites": [{"id": "v014-design-contracts-integration", "required": true, "paths": ["tests/integration/v014_design_contracts"], "ac_ids": ["AC-FR0100-01","AC-FR0200-01","AC-FR0300-01","AC-FR0400-01","AC-FR0500-01","AC-FR0600-01","AC-FR0700-01","AC-FR0800-01","AC-FR0900-01","AC-FR1000-01","AC-FR1100-01","AC-FR1200-01","AC-FR1300-01","AC-FR1400-01","AC-FR1500-01","AC-FR1600-01","AC-FR1700-01","AC-FR1800-01","AC-FR1900-01","AC-FR2000-01","AC-FR2050-01","AC-FR2100-01","AC-FR2200-01","AC-FR2300-01","AC-FR2400-01","AC-FR2500-01","AC-FR2600-01","AC-FR2700-01","AC-NFR0100-01","AC-NFR0200-01","AC-NFR0300-01","AC-NFR0400-01","AC-NFR0500-01","AC-NFR0600-01"], "interface_ids": ["IF-DES-01","IF-DES-02","IF-CON-01","IF-REG-01","IF-TST-01","IF-PC-01","IF-CI-01","IF-REL-01","IF-BLD-01","IF-PUB-01","IF-PRM-01","IF-REV-01","IF-WEB-01","IF-FCT-01","IF-AUD-01"], "architecture_anchors": ["ARC-WEB","ARC-DESIGN","ARC-FACTS","ARC-REGISTRY","ARC-CONTRACTS","ARC-VALIDATE","ARC-PROMPTS","ARC-CI","ARC-PRECOMMIT","ARC-VERSION","ARC-BUILD","ARC-PUBLISH","ARC-REVIEW","ARC-STORE","ARC-MIGRATION","ARC-SECURITY"]}],
    "skip_policy": "Required suite or AC/layer cannot skip; any skip is nonzero", "quarantine_policy": "Only optional diagnostics with issue/owner/expiry; never required evidence", "evidence": {"schema": "runner/project-runner.candidate.json evidence_schema 1.0.0", "formats": ["JUnit","v014-runner-evidence.json"], "required_ac_layer_reconciliation": true}, "teardown": ["persist redacted evidence", "remove temp workspace/HOME/XDG/provider namespace"],
    "failure_policy": {"fail_closed": true, "non_success": ["failure","cancel","timeout","missing","skip","not-run","unknown","zero-collection","evidence-mismatch"], "current_state": "candidate-not-installed"}
  }
}
